{
  "id": "01932d4e-7a3b-7000-8000-000000000001",
  "type": "platform.outbox_published.v1",
  "schema_version": 1,
  "source": "platform",
  "occurred_at": "2026-08-06T00:00:00Z",
  "received_at": null,
  "processed_at": null,
  "recorded_at": "2026-08-06T00:00:01Z",
  "correlation_id": "01932d4e-7a3b-7000-8000-000000000002",
  "causation_id": null,
  "trace_id": "01932d4e-7a3b-7000-8000-000000000003",
  "subject_id": "01932d4e-7a3b-7000-8000-000000000004",
  "partition_key": "order-01932d4e-7a3b-7000-8000-000000000005",
  "data": {
    "outbox_id": "01932d4e-7a3b-7000-8000-000000000006",
    "event_type": "platform.outbox_published.v1"
  }
}
